{
  "$id": "EAyAqJjqLHZqkF7gHoFEagEJNoqNa5TEZlDPdJaVC3GD",
  "name": "GLEIF Well-Known Resources",
  "description": "GLEIF well-known resources for GLEIF, Schema, and Witness discovery",
  "version": "1.0.0",
  "updated": "2025-08-25",
  "resources": {
    "aid": {
      "name": "GLEIF Identifiers",
      "description": "Key Event Receipt Infrastructure OOBIs and related resources",
      "aids": {
        "EDP1vHcw_wc4M__Fj53-cJaBnZZASd-aMTaSyWEQ-PC2": {
          "name": "GLEIF RoOT",
          "oobi": "/keri/oobi/EDP1vHcw_wc4M__Fj53-cJaBnZZASd-aMTaSyWEQ-PC2/index.json"
        },
        "EINmHd5g7iV-UldkkkKyBIH052bIyxZNBn9pq-zNrYoS": {
          "name": "GLEIF External",
          "oobi": "/keri/oobi/EINmHd5g7iV-UldkkkKyBIH052bIyxZNBn9pq-zNrYoS/index.json"
        },
        "EFcrtYzHx11TElxDmEDx355zm7nJhbmdcIluw7UMbUIL": {
          "name": "GLEIF Internal",
          "oobi": "/keri/oobi/EFcrtYzHx11TElxDmEDx355zm7nJhbmdcIluw7UMbUIL/index.json"
        }
      }
    },
    "schema": {
      "name": "Schema Resources",
      "description": "GLEIF vLEI credential schema definitions",
      "schemas": {
        "ENPXp1vQzRF6JwIuS-mp2U8Uf1MoADoP_GqQ62VsDZWY": {
          "title": "Legal Entity vLEI Credential",
          "type": "LegalEntityvLEICredential",
          "version": "1.0.0",
          "oobi": "/schema/oobi/ENPXp1vQzRF6JwIuS-mp2U8Uf1MoADoP_GqQ62VsDZWY/index.json"
        },
        "EBfdlu8R27Fbx-ehrqwImnK-8Cm79sqbAQ4MmvEAYqao": {
          "title": "Qualified vLEI Issuer Credential",
          "type": "QualifiedvLEIIssuervLEICredential",
          "version": "1.0.0",
          "oobi": "/schema/oobi/EBfdlu8R27Fbx-ehrqwImnK-8Cm79sqbAQ4MmvEAYqao/index.json"
        },
        "EKA57bKBKxr_kN7iN5i7lMUxpMG-s19dRcmov1iDxz-E": {
          "title": "OOR Authorization vLEI Credential",
          "type": "OORAuthorizationvLEICredential",
          "version": "1.0.0",
          "oobi": "/schema/oobi/EKA57bKBKxr_kN7iN5i7lMUxpMG-s19dRcmov1iDxz-E/index.json"
        },
        "EH6ekLjSr8V32WyFbGe1zXjTzFs9PkTYmupJ9H65O14g": {
          "title": "ECR Authorization vLEI Credential",
          "type": "ECRAuthorizationvLEICredential",
          "version": "1.0.0",
          "oobi": "/schema/oobi/EH6ekLjSr8V32WyFbGe1zXjTzFs9PkTYmupJ9H65O14g/index.json"
        },
        "EBNaNu-M9P5cgrnfl2Fvymy4E_jvxxyjb70PRtiANlJy": {
          "title": "Legal Entity Official Organizational Role vLEI Credential",
          "type": "LegalEntityOfficialOrganizationalRolevLEICredential",
          "version": "1.0.0",
          "oobi": "/schema/oobi/EBNaNu-M9P5cgrnfl2Fvymy4E_jvxxyjb70PRtiANlJy/index.json"
        },
        "EEy9PkikFcANV1l7EHukCeXqrzT1hNZjGlUk7wuMO5jw": {
          "title": "Legal Entity Engagement Context Role vLEI Credential",
          "type": "LegalEntityEngagementContextRolevLEICredential",
          "version": "1.0.0",
          "oobi": "/schema/oobi/EEy9PkikFcANV1l7EHukCeXqrzT1hNZjGlUk7wuMO5jw/index.json"
        },
        "EMhvwOlyEJ9kN4PrwCpr9Jsv7TxPhiYveZ0oP3lJzdEi": {
          "title": "iXBRL Data Value Attestation",
          "type": "iXBRLDataAttestation",
          "version": "Not specified",
          "oobi": "/schema/oobi/EMhvwOlyEJ9kN4PrwCpr9Jsv7TxPhiYveZ0oP3lJzdEi/index.json"
        }
      }
    },
    "witness": {
      "name": "Witness Resources",
      "description": "KERI witness identifiers and their OOBIs",
      "witnesses": {
        "BDkq35LUU63xnFmfhljYYRY0ymkCg7goyeCxN30tsvmS": {
          "oobi": "/witness/oobi/BDkq35LUU63xnFmfhljYYRY0ymkCg7goyeCxN30tsvmS/index.json"
        },
        "BDwydI_FJJ-tvAtCl1tIu_VQqYTI3Q0JyHDhO1v2hZBt": {
          "oobi": "/witness/oobi/BDwydI_FJJ-tvAtCl1tIu_VQqYTI3Q0JyHDhO1v2hZBt/index.json"
        },
        "BFl6k3UznzmEVuMpBOtUUiR2RO2NZkR3mKrZkNRaZedo": {
          "oobi": "/witness/oobi/BFl6k3UznzmEVuMpBOtUUiR2RO2NZkR3mKrZkNRaZedo/index.json"
        },
        "BGYJwPAzjyJgsipO7GY9ZsBTeoUJrdzjI2w_5N-Nl6gG": {
          "oobi": "/witness/oobi/BGYJwPAzjyJgsipO7GY9ZsBTeoUJrdzjI2w_5N-Nl6gG/index.json"
        },
        "BHxz8CDS_mNxAhAxQe1qxdEIzS625HoYgEMgqjZH_g2X": {
          "oobi": "/witness/oobi/BHxz8CDS_mNxAhAxQe1qxdEIzS625HoYgEMgqjZH_g2X/index.json"
        },
        "BICY3-X3S3iEsKH73Q1fF_w1JrXJ41V0c4Dn9aQjOSQ-": {
          "oobi": "/witness/oobi/BICY3-X3S3iEsKH73Q1fF_w1JrXJ41V0c4Dn9aQjOSQ-/index.json"
        },
        "BLmvLSt1mDShWS67aJNP4gBVBhtOc3YEu8SytqVSsyfw": {
          "oobi": "/witness/oobi/BLmvLSt1mDShWS67aJNP4gBVBhtOc3YEu8SytqVSsyfw/index.json"
        },
        "BLo6wQR73-eH5v90at_Wt8Ep_0xfz05qBjM3_B1UtKbC": {
          "oobi": "/witness/oobi/BLo6wQR73-eH5v90at_Wt8Ep_0xfz05qBjM3_B1UtKbC/index.json"
        },
        "BM4Ef3zlUzIAIx-VC8mXziIbtj-ZltM8Aor6TZzmTldj": {
          "oobi": "/witness/oobi/BM4Ef3zlUzIAIx-VC8mXziIbtj-ZltM8Aor6TZzmTldj/index.json"
        },
        "BNfDO63ZpGc3xiFb0-jIOUnbr_bA-ixMva5cZb3s4BHB": {
          "oobi": "/witness/oobi/BNfDO63ZpGc3xiFb0-jIOUnbr_bA-ixMva5cZb3s4BHB/index.json"
        }
      }
    }
  },
  "metadata": {
    "organization": "Global Legal Entity Identifier Foundation (GLEIF)",
    "contact": "https://www.gleif.org",
    "documentation": "https://gleif-it.github.io/.well-known/"
  }
}